{
  "$schema": "https://schemas.stokerhq.app/plugins/v1/version.schema.json",
  "schemaVersion": "1.0",
  "key": "org.example.widescreen-fix",
  "version": "1.0.0",
  "kind": "hook",
  "released": "2026-10",
  "abi": 1,
  "hosts": ["steamworks", "galaxy"],
  "manifestSha256": "e0e0e0e0e0e0e0e0e0e0e0e0e0e0e0e0e0e0e0e0e0e0e0e0e0e0e0e0e0e0e0e0",
  "config": {
    "type": "object",
    "properties": {
      "aspect": {
        "type": "string",
        "title": "Aspect ratio",
        "description": "The ratio of the display the game runs on.",
        "enum": ["16:9", "21:9", "32:9"],
        "default": "16:9"
      },
      "hudScale": { "type": "number", "title": "HUD scale", "minimum": 0.5, "maximum": 2, "default": 1 },
      "log": { "type": "boolean", "default": false }
    },
    "required": ["aspect"]
  },
  "files": [
    {
      "os": "windows",
      "architecture": "x64",
      "fileName": "widescreen_fix_x64.dll",
      "size": 48640,
      "sha256": "e1e1e1e1e1e1e1e1e1e1e1e1e1e1e1e1e1e1e1e1e1e1e1e1e1e1e1e1e1e1e1e1",
      "blake3": "e2e2e2e2e2e2e2e2e2e2e2e2e2e2e2e2e2e2e2e2e2e2e2e2e2e2e2e2e2e2e2e2",
      "downloads": [{ "url": "https://example.com/widescreen-fix/releases/1.0.0/widescreen-fix-1.0.0.zip", "archive": { "format": "zip", "path": "x64/widescreen_fix_x64.dll" } }]
    },
    {
      "os": "windows",
      "architecture": "x86",
      "fileName": "widescreen_fix_x86.dll",
      "size": 39424,
      "sha256": "e3e3e3e3e3e3e3e3e3e3e3e3e3e3e3e3e3e3e3e3e3e3e3e3e3e3e3e3e3e3e3e3",
      "blake3": "e4e4e4e4e4e4e4e4e4e4e4e4e4e4e4e4e4e4e4e4e4e4e4e4e4e4e4e4e4e4e4e4",
      "downloads": [{ "url": "https://example.com/widescreen-fix/releases/1.0.0/widescreen-fix-1.0.0.zip", "archive": { "format": "zip", "path": "x86/widescreen_fix_x86.dll" } }]
    }
  ]
}
